News,State
"-الأدرينوكروم عقار ماسوني:.(يستخرج من الاطفال بأبشع الطرق)…!!!!!!..كثر الكلام عن الادرينوكروم، ما هو “الأدرينو كروم”وماذا يفعل، وكيف يستخرج، إليك الأتي:يتم تعذيب الطفل و ترهيبه علي يد مؤسسات النخبةبسبب الصدمة والخوف، يرتفع الأدرينالين في دم الطفلبزيادة التخويف و الترهيب و التعذيب يتحول الادرينالين إلي ادرينوكرومولأنتاج لتر واحد فقط!!!يلزم بدبح 30 ألف طفلأما أعضاؤهم فيتم بيعها عبر وكلاءهموالأدرينو كروم له عدة تأثيرات على دماغ الأنسان فيسبب بلعه الشعور بالنشوة،ويعطي درجة عالية من الذهنيةويعتقدون ان شرب هذه المادة، يسمح للشخص الأحتفاظ بشبابه، طبعآ هي أمور شيطانية….وكثير من مشاهير هوليووود مدمنين بهذه المادة بحقنها في الغدة الصنوبرية مباشرةتجارة الأدرينوكروم تبلغ أرباحها السنوية حوالي 38 مليار دولارمن ضمن القائمة المتورطة في هذه التجارة“مؤسسة كلينتون” بتوجيه الأموال عبرElon Muskوغيرها من الشركات لتعزيز التجارب السرية على الأطفال لحصاد الأدرينوكروميوجد إنفاق تحت الأرض “بأنتراكتيكا”وأيضاً ” نيوزلندا” التي تعتبر قلعة  الأتجار بالبشر، والأعضاء البشرية، والدماء لأستخراج الأدرينوكروموأيضاً في قاعدة ” فورد هود العسكرية”بتكساس…الولايات المتحدةهؤلاء يعبدون الشيطان….يخطفون الأطفاليشربون دماءهم…ويأكلون لحومهمو جزيرة ابستين مساحتها لا تتعدى 84 فدان تعتبر مركز انتاج الادرينوكروم في العالم و هذه هي اهم جزء في قضية ابستين حديث الساعة الان في امريكا التي يشترك فيها بيل كلينتون و زوجته ، بيل جيتس و زوجته ميليندا ، ترامب و ابستينAdrenochrome , the devil immortality drug",0
تناقل بعض الناشطين على موقع التواصل الاجتماعي فيسبوك صورة يدّعي ناشروها أنها تظهر تغريدة لقناة RMC sports الفرنسية على موقع تويتر،,0
يتداول رواد مواقع التواصل الإجتماعي ادّعاء يزعم ناشروه أنّه قد تم حذف رمز العلم الفلسطيني من قائمة مفاتيح أجهزة أندرويد الحديثة،,0
أعلن ميجيل كاردوسو، المدير الفنى لفريق الترجى التونسى، التشكيل الأساسى الذى يخوض مواجهة نظيره الهلال السودانى، فى تمام التاسعة من مساء اليوم السبت..,1
"تداولت صفحات عامة وحسابات شخصية على مواقع التواصل الاجتماعي مقطع فيديو ادعوا أنه لـ "" قصف الجيش الروسي العاصمة الأوكرانية كييف بصواريخ تفوق سرعتها سرعة الصوت""، مؤخراً.",0
انتشر على موقع التواصل الاجتماعي فيسبوك ادعاءً يزعم ناشروه أن كسوف الشمس مؤخرًا لم يحدث في الجزيرة العربية منذ مئة عام، ويسمى بالكسوف الحلقي.,0
"تتقاسم أندية برشلونة وريال مدريد الإسبانيين وميلان الإيطالى، صدارة قائمة الأندية الأكثر تتويجا بلقب كأس السوبر الأوروبى على مدار التاريخ.
",1
لقى شخص مصرعه وأصيب 2 آخرين إثر انهيار مبنى تحت الإنشاء بمنطقة القاهرة الجديدة، وتم نقلهم للمستشفى.,1
"نشرت قناة (العربية) السعودية تقريراً بعنوان ""طفل الفسفور.",0
بدأ مجلس الشيوخ خلال جلسته العامة، اليوم، برئاسة المستشار عبدالوهاب عبدالرازق، فى مناقشة طلب مقدم من النائب عادل اللمعي، وأكثر من عشرين عضوا من الأعضاء,1
يستضيف فريق اتحاد جدة السعودي المحترف بين صفوفه الدولي المصري أحمد حجازي نظيره فريق التعاون علي ملعب الملك عبد الله الدولي,1
تستهدف  الخطة الاقتصادية والاجتماعية للعام المالي القادم وصول نسبة الاستثمار الخاص إلى 50% من جملة الاستثمارات لعام 2024/2025، وهذا التوجه نحو زيادة نصيب القطاع الخاص,1
"تداول مستخدمون على مواقع التواصل الاجتماعي، صورة لـ ""أهرامات الجيزة"" في مصر تنعكس عليها صورة العلم الفلسطيني، وزعم متداولو الصورة أنها التقطت مؤخراً في خطوة تضامنية مع الشعب الفلسطي.",0
حدد قانون العمل رقم 12 لسنة 2003، الجهات التي لها الحق في مزاول عمليات إلحاق المصريين بالعمل,1
تمكنت الأجهزة الأمنية بسوهاج، من السيطرة على مشاجرة بدائرة مركز شرطة س وهاج ، وضبط 7 أشخاص من المشاركين فيها من بينهم مصابين,1
وجه المهندس رمضان هلال النقيب العام للتطبيقيين بضرورة صرف المعاشات أعضاء وورثة قبل عيد الفطر المبارك، مشيرا إلى أن النقابة بدأت بالفعل فى الصرف من الفيزا وكذلك البريد المصري,1
"أعلنت رابطة الدوري الإنجليزي الممتاز عن أسماء المدربين المرشحين للفوز بجائزة أفضل مدرب في البريميرليج خلال شهر مارس المنتهي.

",1
قال الدكتور أيمن أبو عمر، من علماء وزارة الأوقاف، إن العيد استراحة وترويح عن النفس، بعد عبادة استمرت 30 يوما، لافتا إلى أن هناك تصرفات تضيع العبادة ومنها ترويع الناس في العيد.,1
في أعقاب انطلاق بطولة كأس العالم لكرة القدم في قطر يوم الأحد 20 نوفمبر 2022،,0
"حدد قانون الطفل الصادر برقم 12 لسنة 1996 المعدل بالقانون 186 لسنه 2023 ، الكثير من الحقوق والواجبات للرضيع للأهتمام بصحة الطفل والحفاظ عليه خلال كافة مراحل نموه

",1
نشر حساب وزارة الخارجية الإسرائيلية على منصة إكس في 4 تشرين الأول/نوفمبر الجاري، صورة ادعى أنها لغلاف عدد السابع من تشرين الأول/أكتوبر من مجلة فوربس Forbes الأمريكية، مع تعليق يقو.,0
قال المهندس أحمد صبور، عضو مجلس الشيوخ، إن قطار التنمية الذي بدأ رحلته منذ ١٠ سنوات بقيادة الرئيس عبد الفتاح السيسي، نجح في إعادة الحياة إلي جميع القطاعات,1
كشف التقرير السنوي للمجلس الأعلى لتنظيم الإعلام، أن لجنة الشكاوى بالمجلس استقبلت 222 شكوى خلال الفترة من يناير 2023 حتى ديسمبر 2023..,1
"تداولت صفحات عامة وحسابات شخصية على مواقع التواصل الاجتماعي مقطع فيديو ادعوا أنه لـ ""تدمير دبابة لعصابة الأسد على محور حزارين بريف إدلب""، مؤخراً.",0
"تداولت صفحات إخبارية على موقع التواصل الاجتماعي ""فيسبوك"" أمس، خبراً قالت فيه إن العاهل السعودي أصدر أمراً ملكياً يوعز فيه للقوات البرية والجوية الاستعداد للدخول إلى سوريا بهدف القضاء على ج.",0
"تداولت قنوات ومواقع إخبارية وحسابات وصفحات على مواقع التواصل الاجتماعي مؤخراً أنباء عن اشتباكات مسلحة عنيفة جرت بين مسلحين من بلدة ""الفوعة"" وآخرين من ""آل بري"" في مدينة حلب.",0
أكد المهندس خالد عباس، رئيس شركة العاصمة الإدارية الجديدة، أن الشركة قدمت العديد من التيسيرات للمطورين,1
"نشرت حسابات Arab-Military  والمشهد الروسي وافاق اليمن على منصة إكس تسجيلاً مصوراً لبناء تلتهمة النيران بينما تعمل إحدى سيارات الإطفاء على إخماده، وزعم الحساب أن ""حزب الله يست.",0
"نشر أوفير جندلمان -المتحدث باسم رئيس الوزراء الإسرائيلي- فجر الثلاثاء 11 أيار/مايو الجاري تسجيلاً مصوراً زعم أنه يظهر إطلاق صورايخ من قبل ""ميليشيا حماس من داخل الأحياء السكنية في قط.",0
تداول ناشطون على مواقع التواصل صورة يزعمون أنها تبين وفاة الخامنئي منذ أسابيع دون أن تبلغ الجهات الرسمية عن وفاته،,0
"قرر الاتحاد الإسباني معاقبة النجم الإنجليزي جود بيلينجهام، بالإيقاف مباراتين ، وتغريمه وناديه ريال مدريد على خلفية عدم إحترام حكم مباراة فريقه فالنسيا عقب الاحداث بعد نهاية المباراة.

",1
قال الكاتب هشام النجار، الباحث في شئون الجماعات المتطرفة، إن برنامج نور الدين للدكتور على جمعة، يعد خطوة مهمة على طريق تجديد الخطاب الدينى، إذ أنه يبتعد عن الأداء,1
يتداول رواد مواقع التواصل صورة يزعمون أنها نشرت بواسطة الرئيس التركي أردوغان، ويظهر فيها واقفًا أمام خريطة لتركيا تتضمن مناطق حلب وأربيل والموصل،,0
نشرت صفحات إخبارية على مواقع التواصل الاجتماعي مؤخراً، تصريحا نسبته للجنرال السابق الأمريكي (بول فاليلي) ورد فيه وصف لقيادات (الجيش السوري الحر) بأنهم مرتزقة، لأنهم لم يكونوا مقاتلين من أج.,0
تناقل ناشطون على مواقع التواصل مقطعًا يدعون أنه يظهر أخطبوطًا حقيقيّا يدخل مرآب سيارات في قطر ويتسبب بتحطيم سيارة،,0
"تداولت صفحات شخصية وحسابات عامة على مواقع التواصل الاجتماعي، حديثاً، صورةً ادعت لـ ""عملة ورقية طبعها البنك المركزي المصري بفئة العشرين جنيه بعلامة مائية تحمل علم الرينبو أو علم ال.",0
تزامناً مع تفاقم أزمة فيروس (كورونا)، تناقل ناشطون على مواقع التواصل الاجتماعي تسجيلاً مصوراً يظهر إلقاء رجل نفسه من بناء مرتفع ليرتطم بعد ذلك بالأرض وسط صرخات المشاهدين.,0
"تداولت صفحات وحسابات شخصية على مواقع التواصل الاجتماعي مؤخراً، صوراً لفتاة تدعى ""صبا خضور"" في أحد ملاعب كرة القدم، وقال ناشرو الصور إن خضور أعلنت عن خلع ثيابها والتعري ببث مباشر في حال فوز.",0
"نشرت مواقع إخبارية وصفحات على مواقع التواصل الاجتماعي في عدة دول عربية ادعاء مرفقاً بصورة كتب عليها ""بعدما أُعلن أنه انقرض رسمياً من العالم، ظهر الضبع المخطط بتلال إحدى القرى، لكن ا.",0
"تداولت مواقع إخبارية ومستخدمون لمواقع التواصل الاجتماعي ادعاء يزعم ""طباعة ورقة نقدية بقيمة عشرة آلاف ليرة سورية مع تصميم لها"".",0
بعد عام من الهجر استيقظ الزوج على كارثة سفر أولاده مع والدتهم خارج مصر دون علمه وإذنه، حاول البحث في كل مكان ليعلم بعد يهشرين مكان تواجدهم وقرر السفر.,1
"تداولت صفحات عامة وحسابات شخصية على مواقع التواصل الاجتماعي، حديثاً، مقطع فيديو ادعت أنه لـ""زواج الإماراتية ليا على الحاخام الإسرائيلي ليفي دوشمان"".",0
تبدأ الهيئة الوطنية للصحافة، برئاسة المهندس عبد الصادق الشوربجي، فتح باب الترشح لانتخابات مجالس الإدارات والجمعيات العمومية للمؤسسات الصحفية القومية,1
كشف سامح عبد الحكيم عضو شعبة الذهب في الغرفة التجارية ، استقرار الطلب في الأسواق خلال الأيام الأخيرة من شهر رمضان المبارك لعام 2024.,1
"نقل موقع قناة ""روسيا اليوم"" عن مصادر وصفها بـ ""المحلية"" خبراً قال فيه إن ""حركة نور الدين زنكي"" أعلنت حل نفسها بالكامل إثر هزيمتها من ""هيئة تحرير الشام"".",0
"نشرت الجريدة الرسمية قرار وزارة الداخلية رقم 648 لسنة 2024، بتعديل بعض احكام اللائحة التنفيذية لقانون المرور الصادر بالقرار الوزاري رقم 1613 لسنة 2008.
",1
ادعت وكالة (سانا) للأنباء التابعة لنظام الأسد اليوم الثلاثاء 15 أيلول/سبتمبر 2020 أن مروحية أمريكية تابعة للجيش الأمريكي سقطت بريف الحسكة، وذكرت الوكالة في خبر عاجل اوردته على موقعها الإلك.,0
عرضت قناة (العربية) الإخبارية اليوم الثلاثاء 26 أيار/مايو عبر صفحتها الرسمية على موقع (فيسبوك) تسجيلا مصوراً، أظهر تحليق طائرات حربية في الجو بشكل استعراضي، مشكلةً بدخانها ألوان العلم الإي.,0
نشرت مواقع إخبارية وحسابات على مواقع التواصل الاجتماعي مؤخراً، خبراً تحدثت فيه عن تصنيف البنية الرقمية السعودية الأنجح في العالم في مواجهة أزمة فيروس كورونا، وذلك من قبل الاتحاد الدولي للا.,0
بدأت أحداث الحلقة الخامسة من مسلسل جودر والذى يعرض على قناة on، بتراجع شهرزاد عن فكرة قتل شهريار بالخنجر أثناء نومه على ركبتها وهى بتحكى حكاية جودر المصرى له.,1
تداول مستخدمو مواقع التواصل الاجتماعي صورة ضمن تقرير عُرض على التلفزيون الأردني يدّعون أنها تعود إلى لقاح COVID19 وأن تاريخ إنتاجه يعود إلى عام 2019…,0
بحسب وكالة الأنباء رويترز، أمر الرئيس الروسي فلاديمير بوتين يوم الأربعاء 21 سبتمبر 2022 بأول تعبئة لروسيا منذ الحرب العالمية الثانية،,0
يطارد النجم الإنجليزي هاري كين مواطنه واين روني على صدارة نجوم إنجلترا الأكثر تسجيلا للأهداف في دوري أبطال أوروبا.,1
"تداولت صفحات عامة وحسابات شخصية على مواقع التواصل الاجتماعي، مؤخراً مقطع فيديو يظهر ما يبدوا أنه مناورة عسكرية جوية لطائرتين حربيتين، وادعوا أنه لـ""منع قاذفات استراتيجية أمريكية م.",0
يتصدر منتخب البرازيل قائمة أكثر المنتخبات فوزا ببطولة كأس العالم عبر التاريخي متفوقًا على كل منافسيه من المنتخبات العريقة في الكرة الأرضية.,1
قال ناجي الشهابي، رئيس حزب الجيل، إن تقديم الدراما التاريخية وتذكير الأجيال الراهنة بأحداث في الماضي، يعد أداة قوية لمحاربة الغزو الفكري وحروب الجيل الرابع، التى تعتمد على تزييف الحقائق. ,1
"بأى حال عدت يا عيد، لكنه ليس كأى عيد فى الوطن العربي، حيث تختفى بهجة العيد خلف الوجه القبيح للحرب فى السودان
",1
"تداولت صفحات عامة وحسابات شخصية على مواقع التواصل الاجتماعي مقطع فيديو ادعوا أنه لـ""مواطن تركي يقتل سائحة في وسط الطريق دهسا ويسرق جثتها""، مؤخراً.",0
أسطورة كروية يفاجئ العالم بشكل قدميه بعد 22 عاما من التألق فى ملاعب العالم، نجح خلالها فى تحقيق كل الألقاب الممكنة على المستوى الفردى ومع الأندية..,1
"تداولت صفحات عامة وحسابات شخصية على مواقع التواصل الاجتماعي خبراً مفاده أن ""مجلس الأمن التركي أبدى استعداد بلاده للانسحاب من سوريا إذا تكفلت روسيا بحماية حدود تركيا"".",0
"شهدت الحلقة الرابعة من مسلسل بدون سابق إنذار للنجم آسر ياسين والنجمة عائشة بن أحمد، الكثير من التطورات والأحداث، بعد أن انتهت الحلقة السابقة بوصول ""مروان"" لابنه الحقيقي..",1
"تداولت مواقع إخبارية أجنبية وعربية خبراً زعمت فيه أن ""طالبان قطعت رأس محجبين حكيمي -لاعبة منتخب الكرة الطائرة الأفغاني- في العاصمة الأفغانية كابول بداية شهر تشرين الأول/أكتوبر 2021"".",0
"ادّعت قناة تحمل اسم (أخبار درع الفرات وغصن الزيتون) يوم الأحد 12 أيلول/ سبتمبر عبر تطبيق تلغرام بأن ""مديرية التربية والتعليم في غصن الزيتون أصدرت قرارا بسبب الأوضاع السيئة التي سببها فيروس.",0
"نشرت وكالة سانا للأنباء التابعة لنظام الأسد خبراً يفيد بتصاعد القصف ""الاسرائيلي"" على قطاع غزة الفلسطيني، مرفقة إياه بصورة تظهر مدنيين يراقبون انفجارات في الأفق من سطح منزل.",0
ينتظر الدولي المصري مصطفى محمد مهمة جديدة مع فريقه نانت عندما يحل ضيفا على مارسيليا فى العاشرة إلا الربع مساء اليوم، الأحد.,1
تداولت حسابات بمواقع التواصل الاجتماعي مجموعة صور خلال اليومين الماضيين من شهر آب/ أغسطس 2022، في سياق أخبار تتحدث عن حرائق واسعة اندلعت في غابات ومناطق حراجية بالجزائر، إلا أن بعض هذه الص.,0
نشرت صفحة (جوك كوزال) يوم السبت 9 كانون الثاني/ يناير خبراً ادعى توزيع  الممثل الهندي الشهير عامر خان  أكياسا من الطحين على الفقراء دون أن يعلن أنها تحتوي في داخلها على مبالغ مال.,0
"تعادل مانشستر سيتي مع مضيفه فريق كريستال بالاس بهدف لمثله، مع نهاية الشوط الأول من المباراة المقامة حاليا على ملعب ""سيلهرست بارك"".",1
"زعم حساب رؤى لدراسات الحرب على منصة ""إكس"" أن الرئيس الفرنسي إيمانويل ماكرون قال إن ""فوج الفيلق المدرع الثاني التابع للجيش الفرنسي انطلق إلى رومانيا للانتشار في أوديسا"".",0
تداولت حسابات على مواقع التواصل الاجتماعي مؤخراً صورة جبل مشتعل بالنيران، وأمامه بحيرة مائية.,0
عزز إيرلينج هالاند نجم مانشستر سيتى، صدارة ترتيب هدافي الدوري الإنجليزي، بعد هدفه أمام أستون فيلا، ومعه اشتد الصراع بعدما سجل محمد صلاح فى تعادل ليفربول..,1
شنت أجهزة محافظة القاهرة حملة مكبرة مشتركة بين الرقابة التموينية والرقابة التجارية وقطاع جنوب تمكنت من السيطرة واحكام الرقابة بنطاق حي البساتين والتحفظ علي 700 كيلو سكر,1
رسالة عاجلة من أطفال فلسطين لكل اليمنيين .,0
"
يتقدم مجلس إدارة وتحرير اليوم السابع، بالتهنئة للقيادات الصحفية الجديدة لرؤساء مجالس الإدارة ورؤساء تحرير المؤسسات القومية",1
"عاش حياته في العمل بجد حتي اصبح من التجار الأثرياء بمنطقة كرداسة، كان يقدم الخير والمساعدة للمحتاجين، وجميع المحيطين حوله يعلمون أنه يدخر أمولا بكميات كبيرة داخل خزينة فيلاته قبل العثور عليه مقتولا، ليصيب جميع مخالطيه حالة من الحزن عليه.

",1
"تقام مباراة تشيلسي ضد ليستر سيتي فى الثالثة إلا الربع عصر اليوم، الأحد، على ملعب ""ستامفورد بريدج"".",1
ننشر سعر الريال القطرى اليوم الأربعاء 3-4-2024، أمام الجنيه المصري بالبنوك العاملة في مصر، مسجلا فى البنك الأهلى المصرى 12.03 جنيه للشراء، و13.03 جنيه للبيع.,1
كلف اللواء أحمد راشد محافظ الجيزة رؤساء الأحياء والمراكز والمدن بمواصلة جهود مواجهة التعديات على الأراضي أملاك الدولة والأراضي الزراعية.,1
تمكنت الدخلية من ضبط صيدلى بالقاهرة لحيازته عقاقير طبية مؤثرة على الحالة النفسية والعصبية وغير مصرح بتداولها خارج الصيدلية فى إطار جهود أجهزة ,1
تداولت صفحات إخبارية سوريّة وحسابات شخصية على مواقع التواصل الاجتماعي اليوم، تسجيلاً مُصوراً بواسطة كاميرا مراقبة، قالوا إنه يصور عملية سطو على محل لبيع المجوهرات الذهبية سوريا.,0
تناقلت صفحات وحسابات شخصية على موقع (فيسبوك) مساء فجر الأربعاء 6 أيار\مايو 2020 خبراً أفاد باندلاع حريق في فرع أمن الدولة التابع لنظام الأسد بمدينة اللاذقية.,0
"نشر حساب أنيس منصور عبر منصة ""إكس""، صورة لشاب يرتدي بزة عسكرية، مع ادعاء يفيد بـ""مقتل جندي اماراتي مشارك في العدوان على غزة""،  كما زعم منصور أن مقتل الجندي هو""اعتراف بمشاركة.",0
"لقرائنا الراغبين فى التعرف على مواقيت الصلاة الصحيحة بمحافظات مصر، يقدم""اليوم السابع"" مواقيت الصلاة الخمسة اليوم الأربعاء فى عدد من محافظات مصر.",1
"نشرت قناة NTV التركية، خبراً بعنوان ""مجموعة سوريين يهاجمون صيدلية مناوبة في مرسين"" قالت فيه، إن عدداً من السوريين تهجموا بالعصي والحجارة على إحدى الصيدليات في مدينة مرسين التركية.",0
نشرت قنوات إخبارية عربية وصفحات عامة على مواقع التواصل الاجتماعي، ادعاءات أن مبان سكنية مأهولة بالمدنيين انهارت في مناطق مختلفة شمال غرب سوريا مع وجود عالقين تحت الأنقاض وذلك إثر.,0
