News,State
"انتشر على مواقع التواصل وتطبيقات الدردشة مؤخراً صورة وثيقة منسوبة لمجموعة MBC السعودية تحمل عنوان: ""مكافئة نهاية الخدمة للأستاذ/جورج قرداحي""، تشير إلى توجيه ""المدير التنفيذي علي جاب.",0
ننشر سعر الدولار أمام الجنيه المصري خلال التعاملات الصباحية اليوم الاثنين 8-4-2024، في عدد من البنوك العاملة في مصر، مسجلا فى البنك الأهلى المصرى 47.50 للشراء، 47.60 جنيه للبيع.,1
تفوق مانشستر سيتي الإنجليزي على ضيفه فريق كوبنهاجن الدنماركي، بنتيجة 3-1 فى الشوط الأول من المباراة المقامة حاليا، ضمن منافسات دوري أبطال أوروبا ..,1
تشهد ملاعب العالم اليوم الاثنين 4 - 3 - 2024 عددا من المباريات فى مختلف المسابقات,1
"تداولت مواقع ومستخدمون على مواقع التواصل الاجتماعي تسجيلاً مصوراً ادّعَوا أنه يظهر ""لحظة ضبط عناصر المخابرات اللبنانية شحنة ضخمة من مخدر الكوكايين محشو داخل باذنجان المكدوس والمخلل.",0
قال طارق الديب، القيادى بحزب مستقبل وطن، إن خطاب الرئيس عبد الفتاح السيسي خلال حفل التنصيب بمثابة خارطة طريق جديدة للدولة المصرية، وتضمن العديد من الرسائل المباشرة بشأن ضرورة مشاركة المصريين. ,1
"يستعد الأهلى لمواجهة زد اف سى المقرر لها السابعة مساء الخميس المقبل باستاد القاهرة الدولى، فى اللقاء المؤجل من الأسبوع الثامن لمسابقة الدوري المصري.
",1
"ألزم قانون الموارد المائية والرى، الوزارة بإنشاء وإحلال وتجديد شبكة المصارف الحقلية المغطاة أو المكشوفة على أن تتصل جميع الأراضى الداخلة فى نطاق وحدة الصرف بسلسلة من المصارف العامة

",1
تداولت مواقع وصفحات إخبارية على مواقع التواصل الاجتماعي اليوم، تسجيلا مصورا يظهر سقوط منصة خلال إلقاء أحد المتحدثين عليها كلمة وسط تجمع جماهيري.,0
يلتقى نادى الهلال ضد الأخدود مساء اليوم الثلاثاء، في مباراة هامة بحثا عن الثلاث نقاط ومواصلة التقدم في جدول ترتيب الدورى السعودى..,1
يتداول روّاد مواقع التواصل صورةً يزعمون أنّها تظهر عضو مجلس القيادة الرئاسي اليمني عيدروس الزبيدي يقبّل رأس نائب رئيس الجمهورية اليمنية السابق علي محسن، بعد استقباله في العاصمة اليمنية عدن مؤخرًا،,0
"زعم رئيس الوزراء الإسرائيلي بنيامين نتنياهو أن دولة ""البوسنة والهرسك تقف مع إسرائيل وتدعم حقها في الدفاع عن النفس ضد الهجمات الإرهابية"".",0
فى اليوم الـ172 للحرب الإسرائيلية المستمرة على غزة، سقط عشرات الشهداء فى قصف للاحتلال على محيط مجمع الشفاء ورفح ومخيمات النازحين فى المواصى غرب خان يونس..,1
أنهى منتخب تونس استعداداته لمباراة نيوزيلندا المقرر إقامتها مساء اليوم الثلاثاء على ملعب استاد القاهرة الدولي، لتحديد المركز الثالث من بطولة كأس عاصمة مصر..,1
"كشف النجم المصرى محمد صلاح لاعب ليفربول الإنجليزي عن لاعبه المفضل الذى يحب رؤيته فى الملعب، بخلاف زميله ماك أليستر لاعب خط وسط الريدز.

",1
تولى خطة 23/2024 اهتمامًا كبيرًا بقطاع الاتصالات وتكنولوجيا الـمعلومات من حيث حجم الاستثمارات التى تم تخصيصها خلال عام الخطة والتى بلغ 83.3 مليار جنيه..,1
سلطت المدير العام  لمنظمة التجارة العالمية wto نجوزي أكونجو إيويالا، عبر الموقع الرسمى للمنظمة، الضوء على نتائج  المؤتمر MC13..,1
نجحت الهيئة العامة للمنطقة الاقتصادية لقناة السويس، في وضع منطقة القنطرة غرب الصناعية على خارطة المناطق الصناعية الجاذبة للاستثمار الأجنبي.,1
ننشر سعر الدولار أمام الجنيه المصرى اليوم الأربعاء 27-3-2024، بالتعاملات الصباحية في البنوك المصرية، مسجلا في البنك الأهلى المصرى 47.73 للشراء، 47.83 جنيه للبيع.,1
اكتسح فريق ليفربول نظيره سبارتا براج بنتيجة 6-1، ليتأهل إلى ربع نهائى الدورى الأوروبى بمجموع 6-1 فى ليلة شهدت دخول محمد صلاح التاريخ..,1
قدم اللواء خالد عبد العال محافظ القاهرة التهنئة للرئيس عبدالفتاح السيسي رئيس الجمهورية بمناسبة بدء ولايته الرئاسية الجديدة وحلف اليمين الدستورية أمام مجلس النواب بمقر العاصمة الإدارية,1
"نشرت صفحات وحسابات محلية على مواقع التواصل الاجتماعي ادعاء بأن ""شاباً سورياً يدعى يوسف حمد الأحمد انتحر بعد انتشار صورته على مواقع التواصل الاجتماعي والتعليق عليها بشكل سلبي"".",0
أكثر من 30 شخصية قدمتها الفنانة ريهام حجاج، عبر مسيرتها الفنية من خلال 30 عملا فنيا ما بين السينما والتليفزيون، جسدت من خلالها أدوار الفتاة الصعيدية والمتمردة والشريرة والطيبة والساذجة..,1
تناقلت مواقع إخبارية وصفحات على مواقع التواصل الاجتماعي ومستخدمون لتطبيقات الدردشة صورة زُعم أنّها تظهر أول قتيل من قوات النظام السوري خلال الحرب الروسية الأوكرانية.,0
انتشرت على مواقع التواصل الاجتماعي صورة يزعم ناشروها أنها تظهر السياسي اليمني رشاد العليمي حاملًا صورة تظهر علم اليمن الجنوبي، ,0
تقدم حزب المصريين الأحرار برئاسة النائب الدكتور عصام خليل بخالص التهنئة إلى الرئيس عبد الفتاح السيسي، رئيس الجمهورية القائد الأعلى للقوات المسلحة.,1
أعلن كارلو أنشيلوتي، المدير الفني لفريق ريال مدريد، عن تشكيل مواجهة مضيفه فريق أوساسونا، والمقرر لها فى تمام الخامسة والربع من مساء اليوم السبت,1
قدمت الفنانة صفاء أبو السعود فقرة فنية خلال مشاركتها في فعاليات الاحتفالية الخاصة بعيد الفطر لأبناء وأسر الشهداء,1
أكد الدكتور محمود عصمت وزير قطاع الأعمال العام، أن استراتيجية الوزارة وخطة عمل شركاتها التابعة تأتي متوافقة مع وثيقة سياسة ملكية الدولة، التي تستهدف توفير المناخ اللازم لزيادة الاستثمارات الخاصة.,1
تتوقع هيئة الأرصاد الجوية ، أن يشهد اليوم الإثنين، طقسا دافئا نهارا على القاهرة الكبرى والوجه البحرى، مائلا للدفء على السواحل الشمالية، مائلا للحرارة على جنوب سيناء وشمال الصعيد..,1
يهدف قانون البنك المركزى والجهاز المصرفي، لرفع مستوى أداء الجهاز المصرفى وتحديثه وتطويره ودعم قدراته التنافسية، بما يؤهله للمنافسة العالمية..,1
وجهت الحكومة استثمارات حوالي 100.7 مليار جنيه خلال العام المالي الجاري 2023/2024 لقطاع الصناعات التحويلية، بنسبة زيادة 19.6% عن الاستثمارات للعام المالي السابق,1
"تداولت مواقع إلكترونية خبراً يزعم ""نشوب حريق هائل بالقرب من #مطار_القاهرة الدولي"" منتصف ليل الأحد 28 آذار/مارس الجاري، وأرفق متداولو  صورة تظهر تصاعد الدخان واللهب في شارع.",0
"تنص المادة 267 على أن من واقع أنثى بغير رضاها يُعاقب بالإعدام أو السجن المؤبد.
",1
نشر موقع الحدث التابع لقناة العربية خبراً ورد فيه أن السلطات السودانية رفضت أمس الأربعاء استقبال وفد قطري برئاسة وزير الخارجية محمد بن عبد الرحمن آل ثاني.,0
"بكل شغف يترقب عشاق كرة القدم انطلاق منافسات بطولة كوبا أمريكا 2024، التي تستضيفها الولايات المتحدة الأمريكية فى الفترة من 20 يونيو.
",1
"
التقى المستشار عبد الوهاب عبد الرازق رئيس مجلس الشيوخ، بمكتبه  اليوم الأحد، بسفير دولة موريتانيا لدى القاهرة الحسين سيدي عبد الله الديه.",1
تناقل ناشطون على منصة فيسبوك مقطعاً يدعون أنه لاختراق الإعلامي أليكس جونز للقمة العالمية للحكومات في دبي وشتم الحضور،,0
كشف مصدر مسئول بوزارة الكهرباء والطاقة المتجددة، أنه تم تخصيص 30 مليار دولار لعمل توسعات بالشبكة الكهربائية استعدادا لدمج القدرات المتوقع إضافتها خلال السنوات المقبلة.,1
حصلت الباحثة إبتسام فوزي تميم علي درجة الدكتوراه في الدراسات الإعلامية من قسم البحوث والدراسات الإعلامية بتقدير مرتبة الشرف الأولى.,1
شهدت الحركة المرورية صباح اليوم السبت، انتظاما على كل الطرق والمحاور وميادين القاهرة والجيزة، وانتظمت حركة السيارات على طرق ومحاور الجيزة وفى شوارع النيل السياحى، والهرم والبحر الأعظم..,1
"عزز فريق ريال مدريد صدارة الدوري الإسباني، بتحقيق فوز جديد على ضيفه سيلتا فيجو، بنتيجة 4-0، فى المباراة التي جمعت الفريقين مساء الأحد على ملعب ""سانتياجو برنابيو"" ",1
تتجه أنظار محبى الساحرة المستديرة فى التاسعة مساء اليوم، السبت، لمتابعة مواجهة من العيار الثقيل التى تجمع بين منتخب إنجلترا مع البرازيل على ملعب ويمبلي.,1
"تداولت صفحات ومجموعات إخبارية على مواقع التواصل الاجتماعي اليوم، خبراً يتحدث عن قيام ""شاب عراقي بقتل 18 شخصاً رمياً بالرصاص دفاعاً عن عشيقته في بغداد"".",0
"نشرت عشرات المواقع الإخبارية العربية اليوم السبت، خبراً بعنوان ""ترامب ينحدر من أصول سورية ""، وتضمن الخبر الذي نقلته عدة مواقع و وكالات إخبارية سورية معلومات تقول أن موقع ""ريديت"" الأمريكي،.",0
تداول رواد مواقع التواصل الاجتماعي ادّعاء يزعم ترشيح الباحثة المصرية الهام فضالي لجائزة نوبل في الفيزياء،فما مدى صحة هذا الادّعاء؟ الجواب في المقال التالي،,0
"تداول مستخدمون على مواقع التواصل الاجتماعي صورة جوية لسفينة الحاويات البنمية الجانحة (إيفر غيفين) تقف بشكل مستقيم داخل قناة السويس مع ادعاء بأن ""السفينة لم تعد جانحة"".",0
"يستقر معرض ""رمسيس وذهب الفراعنة"" الذي يضم 180 قطعة أثرية من مقتنيات المتحف المصري بالتحرير، في محطته الرابعة بمدينة سيدني بأستراليا.",1
أعلن الاتحاد الأرجنتيني لكرة القدم بشكل رسمي اليوم الإثنين استبعاد الأسطورة ليونيل ميسي من معسكر التانجو في أمريكا..,1
تتوقع هيئة الأرصاد الجوية، أن يشهد اليوم السبت، انخفاضا طفيفا فى درجات الحرارة على شمال البلاد حتى القاهرة الكبرى وشمال الصعيد ليسود طقس مائل للحرارة نهارا على القاهرة الكبرى..,1
انتشر ادّعاء أن جائحة كورونا ليست كارثة صحية ولم تؤثر على نسب الوفيات في أمريكا.,0
قال نقيب الأشراف السيد محمود الشريف، إن مصر تحت قيادة الرئيس عبد الفتاح السيسي، تعيش تجربة تنموية كبيرة لاستكمال مسيرة الإصلاح، ومواصلة المشروعات القومية العملاقة..,1
تصدر النجم المصري محمد صلاح لاعب ليفربول الإنجليزي قائمة الأهداف المميزة فى مواجهات مانشستر سيتي ما يجعله مرشحًا لترجيح كفة الريدز.,1
"""جوزى بيضربنى ومش عاوز يصرف على العيال، تزوجنا عرفيا ويرفض الاعتراف بالطفلة ، عندى طفلتين كفيفتين وجوزى هرب ومش عاوز يصرف عليهم، بيشرب مخدرات ومش عاوز يصرف علينا وبيضربنى وهددنى بالقتل""",1
" نشرت مواقع إخبارية ومستخدمون في مواقع التواصل الاجتماعي، خبراً يزعم ""منح الجنسية السعودية بأمر من رئيس مجلس الوزراء لمن ولد داخل المملكة من أب أجنبي وأم سعودية""، وذلك في سيا.",0
"كشفت تقارير صحفية إسبانية أن لاعب خط وسط برشلونة بيدري جونزاليس قرر عدم الخضوع لعملية جراحية.
",1
‏ويغنوا وكأنهم في رحلة وهي رحله فلقد تم ترحيلهم الى الهاوية وسقر ولظى #حلل_يا_دويري من تصوير أحد ضباط جيش الإحتلال,0
يتداول ناشطون على فيسبوك ادعاء يزعم أن الأرض ستدخل ما يسمى “ظاهرة الأفيليون” مما سيؤثر بشكل كبير على برودة الطقس،,0
أعلن لويس كاسترو المدير الفني لفريق النصر، الذي يلعب بين صفوفه الدولي البرتغالي كريستيانو رونالدو، التشكيل الرسمي ضد نظيره الحزم، المقرر اقامتها في تمام السابعة,1
تداولت مواقع إخبارية وصفحات وحسابات على مواقع التواصل الاجتماعي منحازة للنظام السوري صوراً في سياق أحداث محافظة درعا الأخيرة.,0
يتداول رواد مواقع التواصل الإجتماعي صورة يزعم ناشروها أنّها تُظهر تمثال اللاعب محمد صلاح في إنجلترا،,0
تناقل ناشطون على منصة فيسبوك صورة لجوليان أسانج، مؤسس موقع ويكيليكس، والمحتجز في سجن بيلمارش الشديد الحراسة قرب لندن، يدعون أنها تظهر أسانج في السجن،,0
أظهرت بيانات الجهاز المركزي للتعبئة العامة والإحصاء، تراجع واردات مصر الاجمالية من الوقود بنهاية العام الماضي 2023.,1
ننشر سعر الريال القطرى أمام الجنيه اليوم الجمعة 15-3-2024، بالبنوك المصرية، والذي سجل فى البنك الأهلي المصري سعر 12.13 جنيه للشراء، و13.13 جنيه للبيع.,1
"شارك المهاجم المصري محمد شريف فى مباراة فريقه الخليج أمام ضيفه الشباب، التي جمعت الفريقين عصر اليوم، السبت، باستاد "" الأمير محمد بن فهد"".",1
انتشرت على مواقع التواصل الاجتماعي صورة تظهر رجل مسلح يقف خلف مرمى كوت ديفوار خلال المباراة التي جمعت بين منتخب الجزائر وكوت ديفوار (ساحل العاج) في كأس الأمم الأفريقية 2021 في الكاميرون، فما حقيقة هذه الصورة؟,0
"يحل فريق أتلتيكو مدريد ضيفًا على فياريال فى التاسعة مساء اليوم، الإثنين، في ختام منافسات الجولة الـ 30 من مسابقة الدوري الإسباني.
",1
"نشرت مواقع وصفحات إخبارية تصريحاً نسبته للممثل المصري يحيى الفخراني خلال لقاء تلفزيوني قال فيه ""أنا سمعت أنو الاخوة بسوريا بقى عندهم بطاقة ذكية عشان ياخدوا عليها عيش( الخبز ) بصيت.",0
"نشر الحساب الرسمي لسلاح الجو الإسرائيلي على منصة إكس اليوم 17 تشرين الأول/أكتوبر الجاري، مقطع فيديو ادعى أنه لـ""ضرب سلاح الجو الإسرائيلي أهدافًا إرهابية وبنية تحتية عسكرية تابعة ل.",0
أكد هشام عبد العزيز، رئيس حزب الإصلاح والنهضة، على أهمية التقدم الذي تحقق في الخطة التنفيذية للإجراءات المُقترحة من الحوار الوطني، الذي استعرضه الدكتور مصطفى مدبولي، رئيس مجلس الوزراء.,1
"  ادّعى موقع (Jannah news) يوم الإثنين 8 تشرين الثاني/ نوفمبر الجاري ""قيام مجموعة من الشبان الموالين برفع علم النظام السوري على دوار الساعة في مدينة الرقة الخاضعة لسيطرة.",0
أصدر الجهاز القومي لتنظيم الاتصالات، تقرير منظومة متابعة شكاوى مستخدمي خدمات الاتصالات عن عام 2023، والذي يعرض أهم المؤشرات..,1
رئيس الوفد اليمني يقول لبشار الاسد اين البراميل والطيران,0
قال اللواء أحمد راشد محافظ الجيزة إن تبادل التهاني والزيارات في المناسبات والأعياد بين أبناء الشعب المصري.,1
"يستضيف فريق مانشستر سيتى الإنجليزى، نظيره كوبنهاجن الدنماركي في إياب دور ثمن النهائي ببطولة دوري أبطال أوروبا والتي ستقام علي ملعب الاتحاد.

",1
ننشر سعر الدينار الكويتي أمام الجنيه المصري اليوم الخميس 4-4-2024، في عدد من البنوك المصرية، مسجلا فى البنك الأهلى المصرى سعر 153.16 جنيه للشراء، و154.20 جنيه للبيع.,1
فى أحداث الحلقة 11 من مسلسل بيت الرفاعى، والذى يُعرض على قناة ON بالتزامن مع عرضه على منصة watch it، ضمن دراما رمضان 2024، ذهب ياسين,1
أعلن مجلس القبائل والعائلات المصرية، عن تنظيم أطول مائدة إفطار بدون طعام، بطول 8 كيلومترات على شاطئ مدينة العريش بشمال سيناء. وتم الإعلان عن عدم وجود طعام,1
تألقت النجمة صابرين فى مسلسل «مسار إجبارى» الذى عرض فى النصف الأول من رمضان الجارى، وقدمت فيه دور الأم بشكل مغاير تماما، وأيضا الأرملة التى تكتشف أنها لها ضرة بشكل مفاجئ,1
بدأت الحلقة السابعة من مسلسل بقينا اتنين، بطولة النجم شريف منير والنجمة رانيا يوسف، باعتراف أدهم أباظة بكذب ابنه مروان عليه منذ 12 عاما، بأنه يلعب ألعابا قتالية، ويوهم والده بأنه يلعب كرة قدم..,1
"تداول مستخدمون لمواقع التواصل الاجتماعي مؤخراً ادعاء بـ ""وفاة والدة لاعب منتخب المغرب لكرة القدم سفيان بوفال"".",0
انتشر على مواقع التواصل الاجتماعي خبر يزعم ناشروه أن مدينة دبي الإماراتية تحتفل بمرور 41 سنة على عدم انقطاع الكهرباء لمدة ثانية واحدة،,0
تداولت مواقع وصفحات إخبارية على مواقع التواصل الاجتماعي، خبراً يدعي اعتقال أحد المجندين في صفوف جيش النظام السوري على خلفية دعوات نشرها عبر حسابه الشخصي بموقع (فيسبوك) للتظاهر احت.,0
"نشر الموقع الرسمي لقناة ""الميادين"" اليوم الأحد خبراً بعنوان ""شهداء في حلب بعد استهداف أحيائها من الجماعات المسلحة""، أرفقه بصورة لشارع تعرض للقصف وقال في وصف الصورة: ""استشهاد سبعة مدنيين بس.",0
"طالب عدد من مشجعى نادي تشيلسي الإنجليزي بعودة المدرب البرتغالي جوزيه مورينيو، مع تزايد الضغط على الأرجنتيني ماوريسيو بوتشيتينو.
",1
"أنهى فريق ريال مدريد أحداث الشوط الأول من مواجهة نظيره فالنسيا، متأخرا بنتيجة 2-1، خلال اللقاء الذي يجمع الفريقين حاليا على ملعب ""ميستايا""..",1
انتشر على موقع التواصل الاجتماعي فيسبوك مقطعًا يظهر فيه الدكتور ماجد العاني مدّعيًا بأن منظمة الصحة العالمية أعلنت أن فيروس كورونا سينتهي في نيسان / إبريل 2021 سواء مع اللقاح أو بدونه.,0
شهد أمس الخميس 29 - 2 - 2024 إقامة عدد قليل من المباريات، أبرزها مواجهات الدوري المصري والسعودي، بالإضافة إلى مباراة أتلتيك بيلباو وضيفه أتلتيكو مدريد..,1
أقر المتهم بقتل سائق بمنطقة بولاق الدكرور وإشعال النيران بجثته أمام جهات التحقيق بارتكاب الجريمة، وبرر فعلته بوجود خلافات مالية بينه وبين المجنى عليه..,1
شهدت مباريات أمس الإثنين اقتراب إنتر ميلان من الفوز بلقب الدوري الإيطالي بعدما حقق فوزًا مستحقًا على حساب أودينيزي بنتيجة 2-1 في المباراة التي أقيمت بينهما..,1
‏نجحت شركة مصر للغزل والنسيج بالمحلة الكبرى، فى إعادة تشغيل مصنع 5  القديم بالإضافة إلى تشغيل جزئي لبعض المصانع الأخرى.,1
هنأت الدكتورة ياسمين فؤاد وزيرة البيئة، الرئيس عبد الفتاح السيسي رئيس الجمهورية، بتولي سيادته ولاية رئاسية جديدة.,1
"قال جمال عبد الرحيم، سكرتير عام نقابة الصحفيين، إن يوم الأرض هو اليوم المجيد فى تاريخ القضية الفلسطينية، مضيفا أن النقابة لم تتوانى فى مساندة الشعب الفلسطينى.

",1
توالت خلال اليومين الفائتين ردود الأفعال الدولية إزاء مقتل زعيم (فيلق القدس) الإيراني قاسم سليماني، ولم تخلُ الأخبار المتعلقة بهذا الحدث من التضليل والمعلومات الملفقة.,0
