News,State
كدت النائبة مايسة عطوة عضو لجنة التضامن الإجتماعى بمجلس النواب أن التحالف الوطني للعمل الأهلي سند لكل المصريين، فهو أحد أركان مسارات التنمية الشاملة في الجمهورية الجديد.,1
"اقتنص إشبيلية فوزا ثمينا من ضيفه ريال سوسيداد بثلاثة أهداف مقابل هدفين، في المباراة التى جمعت الفريقين اليوم، السبت، على ملعب ""رامون سانشيز بيزخوان"".",1
"تمكنت الداخلية من ضبط 6 عناصر إجرامية بنطاق محافظتى ""أسيوط ، قنا"" وبحوزتهم كميات من المواد المخدرة حيث تقدر قيمتها المالية بـ 3 ملايين جنيه.",1
أكد الدكتور طه زيدان عضو مجلس إدارة غرفة صناعات مواد البناء باتحاد الصناعات، أن الولاية الجديدة للرئيس عبدالفتاح السيسي تأتي استجابة لتطلعات الشعب المصري في تحقيق الاستقرار الأمني للمنطقة.,1
وافق مجلس إدارة هيئة المجتمعات العمرانية الجديدة، فى اجتماعه برئاسة الدكتور عاصم الجزار، وزير الإسكان والمرافق والمجتمعات العمرانية، بحضور عدد من الأعضاء.,1
"يُطارد فريق الزمالك أكثر من هدف خلال مباراة اليوم ،الأحد، أمام فيوتشر في أياب ربع نهائي بطولة الكونفيدرالية الأفريقية.

",1
دعا الدكتور أيمن محسب، وكيل لجنة الشؤون العربية بمجلس النواب، كافة القوي الإقليمية والدولية بالضغط علي إسرائيل من أجل إزالة العوائق والقيود التي تضعها أمام عملية دخول المساعدات عبر المنافذ البرية.,1
ناقشت لجنة الإدارة المحلية بمجلس النواب، طلبي الإحاطة المقدمين من النائب محمد عبد السلام حجازي، بشأن بطلان عقد البيع الابتدائي المؤرخ في 15/6/2009 لقطعة الأرض رقم 507 من 6 أصلية بحوض المحجرة 3.,1
نشرت مواقع إخبارية سعوديّة خبراً، عن صدور أمر ملكي جديد، ينص على منح الجنسية السعودية للأجانب المولودين على أراضي المملكة، بعد أن يتم بلوغهم العامين.,0
"تداولت صفحات عامة وحسابات شخصية على مواقع التواصل الاجتماعي، حديثاً، مقطع فيديو ادعت أنه لـ ""احتراق سفينة كالاندرا المملوكة لشركة الشحن الإسرائيلية ZIM، في المحيط الهندي"".",0
"تداولت صفحات إخبارية وحسابات شخصية على مواقع التواصل الاجتماعي، حديثاً، مقطع فيديو يظهر عدة مشاهد لما يبدو أنها مناورات وتدريبات عسكرية لقوات بحرية وجوية، وادعت أنه لـ ""تجمع الأسط.",0
"نشر حساب يحمل اسم ""فدائي السيد عبد الملك الحوثي"" على منصة ""إكس"" صورة لأعمدة من اللهب تتصاعد من داخل منطقة مدنية وزعم أنه لـ ""القاعدة الأمريكية في حقل غاز كونيكو في دير الزور.",0
تناقل ناشطون على منصات التواصل مقطعاً يدعون أنه يظهر اكتشاف أسماكاً على هيئة وجوه البشر في بحيرة تدعى “سامسارا”،,0
قال رجل الأعمال أيمن الجميل إن الرؤية الاستراتيجية للرئيس عبد الفتاح السيسي والاستثمار العاجل فى جميع عناصر الإنتاج الزراعى,1
يتساءل البعض عن دعاء الإفطار فى رمضان، والذى يجب قوله مع سماع أذان المغرب وقبل بدء تناول الإفطار.,1
أفاد موقع I 24 الإسرائيلي بمقتل المدعو عباس أحمد خليل بغارة إسرائيلية يوم السبت الماضي في منطقة الناقورة جنوب لبنان، وادعى الموقع أن ذلك الشخص هو حفيد حسن نصر الله متزعم حزب الله.,0
يستضيف فريق الهلال نظيره اتحاد جدة المحترف ضمن صفوفه الدولى المصري أحمد حجازي في كلاسيكو السعودية علي ملعب المملكة آرينا لحساب الجولة الـ 22,1
انتشر على مواقع التواصل الاجتماعي مقطع فيديو يزعم ناشروه أنه يظهر شاب اندونيسي يرفع الاذان في برنامج المواهب الأسترالي لتجربة الأداء،,0
"وجهت الحكومة في خطتها للعام المالي الجاري 2023/2024  استثمارات كلية (عامة وخاصة) للخدمات الصحية تقدر بنحو 75 مليار جنيه بنسبة 4.6% من الاستثمارات الإجمالية للخطة فى العام ذاته.

",1
لقت طالبة مصرعها صدمتها سيارة على أثناء عبورها الطريق في التجمع، وعلى الفور تم نقل جثمانها إلى مشرحة المستشفى، وتحرر المحضر اللازم وتولت النيابة المختصة التحقيق.,1
"رفضت مغادرة الحرب عقب تركيب الأطراف الصناعية لى وقررت الاستمرار في الدفاع عن بلدى مصر
",1
انتشرت على مواقع التواصل الاجتماعي مؤخراً، صورة قيل إنها تظهر كيف أحرقت امرأة زوجها بواسطة مدفأة كهربائية، وتعددت الروايات التي رافقت  المذكور حول جنسية المرأة والزوج.,0
بحسب وكالة رويترز للأنباء، فقد شنت روسيا غزوًا شاملًا على أوكرانيا صباح يوم الخميس 24 فبراير 2022،,0
أنهت البورصة المصرية، تعاملات جلسة اليوم الأربعاء، بتراجع جماعي للمؤشرات بضغوط مبيعات المتعاملين المصريين والعرب فيما مالت تعاملات الأجانب للشراء,1
"تداولت صفحات عامة وحسابات شخصية على مواقع التواصل الاجتماعي مقطع فيديو ادعوا أنه "" لصاروخ أطلقته المقاومة الفلسطينية ووصل مستوطنة رحوفوت جنوب تل أبيب "" حديثاً.",0
"تداولت صفحات عامة وحسابات شخصية لمستخدمين أجانب على مواقع التواصل الاجتماعي، حديثاً، مقطع فيديو ادعو أنه لـ ""هبوط حماس بالمظلات على إسرائيل"".",0
تمكنت مديرية أمن أسيوط، خلال حملات أمنية متنوعة على مراكز المحافظة، من ضبط 30 قطعة سلاح متنوعه ما بين أسلحة آلية وذخيرة وأسلحة متنوعة.,1
سجلت أسعار النفط اليوم الثلاثاء، 90.78 دولار للبرميل للعقود الآجلة لخام القياس العالمى برنت،كما سجلت العقود الآجلةلخام غرب تكساس الوسيط الأمريكى 86.78دولار للبرميل,1
أقرت لجنة التضامن والأسرة والأشخاص ذوي الاعاقة بمجلس النواب، برئاسة النائب الدكتور عبد الهادي القصبي،الفئات التي يصرف لها الدعم النقدي المشروط (تكافل),1
"تداولت قنوات وصفحات إخبارية ومستخدمون لمواقع التواصل الاجتماعي تسجيلاً مصوراً ادعوا أنه يُظهر ""اللحظات الأولى لبدء الهجوم الروسي على أوكرانيا"".",0
تنظم نقابة الصحفيين إفطارها السنوى بعد غدٍ الأحد 31 مارس، فى ذكرى العيد الثالث والثمانين لإنشاء نقابة الصحفيين، يوم 31 مارس 1941م، متضمنًا وجبات صيامية للزملاء المسيحيين.,1
أقامت زوجة دعوي طلاق للضرر ضد زوجها، أمام محكمة الأسرة بمصر الجديدة، ادعت خشيتها على نفسه من تهديداته، واتهمته بسرقة حقوقها الشرعية من -مصوغات ومنقولات- بمبلغ مالي 700 ألف جنيه..,1
انتشر على مواقع التواصل الاجتماعي حديثاً، منشورات زعمت أن مجلة تايم الأمريكية اختارت الفلسطيني خالد نبهان كشخصية العام.,0
"نشر حساب شبكة WHR على منصة  ""إكس"" تسجيلاً مصوراً لمغني الراب الأمريكي ""ديدي"" يتراقص أمام إحدى الطائرات الخاصة وقال الحساب في تقديمه للفيديو ""بعد هروبه من السلطات قبل يومين.",0
"نشرت مجموعات وصفحات إخبارية، فجر يوم أمس الخميس، خبر  اقتتال بين فصائل ""الجيش الوطني"" التابع للمعارضة السورية في محيط منطقة تل تمر بريف مدينة رأس العين شمال شرقي سوريا، وأرفق ناشرو ال.",0
"تداولت مواقع إخبارية عربية وتركية اليوم الخميس 11 آذار/مارس، ادعاء ""نقل رئيس النظام في سوريا بشار الأسد وزوجته أسماء إلى العاصمة الروسية موسكو على متن طائرة خاصة"" إثر إصابتهما بفي.",0
 أكد الدكتور السيد قنديل رئيس الجامعة، على أن الطالب هو محور العملية التعليمية بالجامعة، مشددًا على ضرورة الاستماع لآرائهم ومقترحاتهم وتوفير كل السبل لتحقيق أفضل بيئة تعليمية..,1
يتساءل البعض عن دعاء الإفطار فى رمضان، والذى يجب قوله مع سماع أذان المغرب وقبل بدء تناول الإفطار.,1
تداولت حسابات على مواقع التواصل الاجتماعي، صورة تظهر رجلاً بلباس خليجي وإلى جانبيه طفلان بشعر مجدول و قبعة صغيرة سوداء على رأسيهما.,0
تأهل باير ليفركوزن للمباراة النهائية لبطولة كأس ألمانيا، بعد فوزه الكاسح على ضيفه فريق فورتونا دوسلدورف، بنتيجة 4-0، في المباراة التي جمعتهما مساء الأربعاء..,1
لە تۆڕی کۆمەڵایەتی فەیسبوک ڤیدیۆیەک بڵاوکراوەتەوە کە بانگەشەی ئەوە دەکرێت هی شەمەندەفەرێکی خێرا بێت کە لە وڵاتی چین دروستکراوە و دەتوانێت بە خێرایی ١٣٥٠ کم\ک بڕوات.,0
يحدد أجر أو دخل التسوية قانون التأمينات الاجتماعية والمعاشات رقم 148 لسنة 2019، عن مدة الاشتراك التي تبدأ من تاريخ العمل بأحكام هذا القانون على أساس المتوسط الشهري للأجور,1
انتشر على مواقع التواصل الاجتماعي خبر مفاده ان البيان الختامي لمؤتمر دعم استقرار ليبيا لم يتضمن إجراء الانتخابات في موعدها المقرر يوم 24 ديسمبر 2021، فما حقيقة هذا الخبر؟,0
"قررت محكمة جنايات القاهرة، تأجيل محاكمة عامل، بتهمة الاتجار فى النقد الأجنبى لجلسة 21 أبريل..


",1
"اختتم صندوق رعاية المبتكرين والنوابغ المرحلة الأولى من مسابقة ""قمة مصر للمشاريع الاستثمارية المجتمعية"" بالتعاون مع منظمة Hult Prize العالمية..
",1
تمكنت الأجهزة الأمنية بمديرية أمن القاهرة من ضبط (عاطلان) بدائرة قسم شرطة التجمع الأول حال استقلالهما سيارة مُحمل عليها عدد من الأسياخ الحديدية..,1
"رصد موقع ""برلماني""، المتخصص في الشأن التشريعى والنيابى، في تقرير له تحت عنوان: ""هل مجاورة المأذون بضبطه تجيز القبض والتفتيش؟""",1
"نشرت وسائل إعلام تركية اليوم، أخباراً نقلت فيها عن السلطات التركية إعلانها عن ""تحييد مسؤولة استخباراتية في حزب العمال الكردستاني PKK في عملية خاصة شمالي العراق""، وأرفق الخبر الذي.",0
يشتعل الصراع على صدارة جدول ترتيب الدوري الإنجليزي الممتاز بين فريقى ليفربول المحترف ضمن صفوفه النجم المصرى محمد صلاح، ومانشستر سيتى..,1
استضافت قناة (الجزيرة) الإخبارية مساء الثلاثاء 8 كانون الأول/ديسمبر ضمن برنامجها الأسبوعي (الاتجاه المعاكس) الذي يقدمه الإعلامي السوري (فيصل القاسم)، معارضاً سورياً يدعى (عبد الرحمن الصالح.,0
"تشهد ملاعب العالم اليوم الجمعة 8-3-2024 عدد من المباريات فى مختلف المسابقات، يتصدرها مباراة برشلونة ضد ريال مايوركا فى الدوري الإسباني، فضلا عن مواجهة الأهلى والزمالك فى نهائي كأس مصر.

",1
هناك العديد من الآثار المتوقعة على الاقتصاد العالمي جراء استمرار الحرب على غزة، وهو ما كشفته دراسة أن الحرب بين إسرائيل وغزة..,1
"رصد موقع ""برلماني""، المتخصص في الشأن التشريعى والنيابى، في تقرير له تحت عنوان: ""دولة التلاوة.. الحماية القانونية لقراء القرآن والمنشدين"".",1
يتداول مستخدمون لوسائط التواصل الاجتماعي مقطع فيديو يصور طفلا يتلو القرآن الكريم، ويزعم ناشروه أنه أبكى بتلاوته الممثل الهندي سلمان خان ولجنة التحكيم في برنامج “آيدول جونيور Idol Junior 2021“،,0
"نستعرض لكم طوال شهر رمضان المبارك تقريرا يوميا بعنوان ""مدفع الإفطار"" ونستعرض خلاله قصة أجمل الأهداف عبر تاريخ كرة القدم، والتى جاءت من تصويبات بعيدة المدى.",1
"ادّعى موقع (Roz Press) الإخباري عبر صفحته على موقع فيسبوك أن وزير الدفاع التركي خلوصي آكار قال إن ""عملياتنا في سوريا تم تأجيلها إلى إشعار آخر لأسباب تتعلق بالضغوطات الدولية"".",0
تداول ناشطون على فيسبوك صورةً يزعمون أنها تظهر طوابير في الجزائر من أجل شراء جهاز آيفون 14 الذي كشفت شركة آبل النقاب عنه مؤخرًا،,0
"رفض المدرب البرتغالى جورجى جيسوس، المدير الفنى لفريق الهلال السعودى، الحديث عن مستقبله مع الزعيم.
",1
 أعلن مجلس الذهب العالمي خلال الأسبوع الماضي عن بيانات التدفقات النقدية إلى صناديق الاستثمار المتداولة المدعومة بالذهب خلال الأسبوع المنتهي في 22 مارس، ليظهر صافي تدفقات خارجة من الصناديق بمقدار 3.4 طن ذهب.,1
"نشرت صفحات محلية ومستخدمون لمواقع التواصل الاجتماعي ادعاء بأنَّ الدكتور نبوغ العوا -عضو الفريق الحكومي المعني بالتصدي لكورونا التابع للنظام السوري- قال ""يجب عودة الحظـر الجزئي في سو.",0
تداول ناشطون على مواقع التواصل الاجتماعي مؤخراً خبراً ورد فيه أن فرنسا أخرجت حاملي الجنسية الفرنسية ذوي الأصول غير الفرنسية من المستشفيات لترك أماكن للمواطنين الفرنسيين ذوي الأصول الفرنسية.,0
"تداولت صفحات عامة وحسابات شخصية على مواقع التواصل الاجتماعي، حديثاً، مقطع فيديو يظهر تجمع قبائل مع عتادهم العسكري، وادعت أنه لـ ""حشود وقبائل يمنية تتجة إلى السواحل اليمنية و البحر.",0
أكد الدكتور أسامة الأزهرى، مستشار رئيس الجمهورية للشئون الدينية، أن الحب هو الذى يطفئ نيران الكراهية وهو الذي ينبت معاني الحياة.,1
عقدت أسماء مخلوف، رئيس جهاز تنمية مدينة السويس الجديدة، ندوة توعوية للمستثمرين بالمنطقة الصناعية بعتاقة بالقطاع الأول بمدينة السويس الجديدة، حول قانون البيئة الخاص بتنظيم إدارة المخلفات..,1
"أعلن المدرب أوناي إيمري المدير الفني لفريق أستون فيلا ونظيره أنجي بوستيكوجلو مدرب توتنهام هوتسبير التشكيل الرسمي للمباراة التي ستجمعهما بعد قليل على ملعب ""فيلا بارك"".",1
عانق الأسطورة الأرجنتينية ليونيل ميسي، لاعب إنتر ميامي الأمريكي، المجد فى 2023 الكروي، بعدما توج بالكرة الذهبية للمرة الثامنة.,1
مصر الخضراء، كلمة شاسعة التفاصيل، تحمل فى طياتها الكثير والكثير من المشروعات البيئية والصناعية الصديقة للبيئة ،,1
"نشرت وسائل إعلامية وحسابات على مواقع التواصل الاجتماعي أمس السبت، صورة للقيادي في ""الحرس الثوري الإيراني"" قاسم سليماني، وبجانبه شخص، قالت هذه الوسائل والحسابات إنه أمجد يوسف، أحد مر.",0
"ادعت وسائل إعلام عربية ومستخدمون لمواقع التواصل أن ""الفنانة اللبنانية أليسا ارتدت في حفلها الغنائي الأخير في العراق درعاً واقياً من الرصاص صممته شركة ألمانية خوفاً على حياتها"".",0
انتشرت على مواقع التواصل الاجتماعي أمس، صورة لشاب يلتقط لنفسه صورة (سيلفي) ويظهر بجانبه خمسة أطفال حديثي الولادة، وترافق انتشار الصورة مع تعليق يقول إنها لشاب سوري رزق بخمسة توائم.,0
أعلن الجهازان الفنيان لفريقى طرابزون سبور الذي يلعب بين صفوفه الدولي المصري محمود تريزيجيه، وألانيا سبور الذي يضم المهاجم أحمد حسن كوكا التشكيل الرسمي.,1
كشفت تقارير صحفية إيطالية عن اقتراب تشيرو إيموبيلي نجم هجوم لاتسيو من مغادرة نادى العاصمة الإيطالية خلال فترة الانتقالات الصيفية..,1
"أعلن كارلو أنشيلوتي، المدير الفني لفريق ريال مدريد الإسباني، عن تشكيل مواجهة ضيفه فريق مانشستر سيتي الإنجليزي، والمقرر لها في تمام التاسعة من مساء اليوم الثلاثاء، على ملعب ""سانتياجو برنابيو""",1
تواجد الدولى المصرى أحمد حجازى، مدافع اتحاد جدة، فى التشكيل المثالى للجولة الـ21 من مسابقة الدوري السعودي للمحترفين بالموسم الجارى 2023-2024.,1
"زعمت صفحات إخبارية وحسابات شخصية على مواقع التواصل الاجتماعي، مقتل خالد نبهان الملقب بـ""أبو طارق"" صاحب عبارة روح الروح، وسط تداول واسع ضمن منشورات تنعي الجد الفلسطيني.",0
أكد الدكتور محمد معيط وزير المالية، أن إعلان مجلس المديرين التنفيذيين لصندوق النقد الدولي، الموافقة على تسهيل ائتماني ممتد لبرنامج الإصلاح الاقتصادي المصري بتمويل 8 مليارات دولار,1
تحدث زلاتكو داليتش، المدير الفني لمنتخب كرواتيا، عن مواجهة المنتخب الوطنى فى نهائي بطولة كأس عاصمة مصر باستاد مصر بالعاصمة الإدارية الجديدة.,1
"واصلت الإدارة العامة للمرور توجيه الحملات المرورية لتحقيق الانضباط، وتطبيق قانون ولوائح المرور على قائدي السيارات وضبط المخالفين منهم، أسفرت جهودها خلال 24 ساعة عن ضبط 14962 مخالفة مرورية متنوعة.
",1
العقيد الأمريكي المتقاعد “دوغلاس ماكغريغور”:القوات الأمريكية الخاصة دخلت إلى غزة لإنقاذ الرهائن، ولكنها تكبدت خسائر فادحة وانسحبت.لشدة القصف الأمريكي المشارك على غزة؟قصفوا مجموعات اسرائيلية وقتلوا عدد منالجنود !!,0
يظل الدكتور خالد عبد الغفار صاحب النقلة النوعية فى القطاع الصحى، ويوما تلو الآخر يؤكد أنه يمثل بالفعل النموذج الحى للوزير المتمكن من قدراته,1
"أعلن المستشار الدكتور محمد أبو ضيف، الأمين العام للمجلس الأعلى للنيابة الإدارية، رئيس اللجنة المشرفة على انتخابات نقابة المحامين لعام 2024،
",1
أكد توماس توخيل، المدير الفني لفريق بايرن ميونخ الألماني، أن التأهل لربع نهائي دوري أبطال أوروبا أعطى فريقه ثقة كبيرة فى المنافسة على لقب الدوري الألماني.,1
"تداولت صفحات إخبارية وحسابات عامة على مواقع التواصل الاجتماعي، حديثاً، مقطع فيديو لحفرة طينية يخرج منها سائل أسود عالي الكثافة، مدعي أنه لـ "" خروج النفط الخام من باطن الأرض في جبا.",0
أقامت شركة جزيرة الدهانات، إحدى الشركات الرائدة في مجال الدهانات والأصباغ في مصر، سحورًا خاصًا في فندق النيل ريتز كارلتون بالقاهرة يوم 26 مارس 2024. ,1
 تداولت صفحات وحسابات بمواقع التواصل الاجتماعي خلال اليومين الماضيين من شهر تشرين الثاني 2022، ادعاء يزعم أن السلطات القطرية، منعت دخول طائرة منتخب ألمانيا إلى قطر التي تستضي.,0
نظمت جامعة القاهرة تحت رعاية الدكتور محمد الخشت رئيس الجامعة، وإشراف الدكتور محمد سامي عبد الصادق نائب رئيس الجامعة لشئون خدمة المجتمع وتنمية البيئة، زيارة لطلاب الجامعة للأماكن والمواقع الأثرية...,1
يتداول رواد مواقع التواصل الاجتماعي  ادعاءً يزعم  أنّ إثيوبيا قطعت إمداد الكهرباء عن السودان، واستند الاّدعاء إلى مقطع فيديو يُظهر رئيس الطاقة السوداني  يتحدث في مؤتمر صحفي،,0
"تداولت صفحات سورية عامة وحسابات شخصية على مواقع التواصل الاجتماعي ادعاءً بأن ""البنك المركزي سيُخضع للتحقيق كل مواطن تجاوزت ثروته المليار""، دون تبيان العملة المقصودة، أهي ليرة سوري.",0
"أكد حزب المستقلين الجدد، ترحيبه بقرار مجلس الأمن والذي يعد الأول من نوعه من بدايه الحرب على غزه ويعتبر خطوه جيده في ظل وجود انحياز أمريكي لاسرائيل.

",1
