News,State
"أعلنت وزارة الأوقاف قراءة سورة الواقعة بالمساجد الكبرى عقب صلاة العصر، وقراءة سورة الرحمن عقب صلاة التراويح والصلاة على النبي..
",1
"الموتى لا يكذبون، يخبرونك بالحقيقة، أو فقط يصمتون، هكذا هي الحياة داخل ثلاجة الموتى لا حديث سوى بالحقيقة، فهنا عالم لا يعرف الكذب والنفاق.

",1
نجحت الداخلية في ضبط كميات كبيرة من التبغ مجهول المصدر بحوزة 4 أشخاص بالقاهرة داخل مخزن بدون ترخيص فى إطار جهود أجهزة وزارة الداخلية لمكافحة الجريمة بشتى صورها..,1
وجه النائب محمد الجارحي، وكيل لجنة المشروعات الصغيرة والمتوسطة بمجلس النواب، التهنئة لفخامة الرئيس عبدالفتاح السيسي رئيس الجمهورية وجموع الشعب المصري العظيم,1
اندلع حريق داخل منزل فى منطقة الصف، وعلى الفور تمت السيطرة عليه دون إصابات وتولت النيابة المختصة التحقيقات.,1
قالت النقابة العامة للأطباء، إن آخر موعد لتواجد موظفي إدارة التراخيص الطبية بوزارة الصحة، في مقر نقابة الأطباء، لإنهاء كل إجراءات الحصول على ترخيص مزاولة المهنة والقيد بالنقابة..,1
"تداول مستخدمون على مواقع التواصل الاجتماعي خبراً يدعي أن ""وزارة الهجرة الدنماركية طلبت من الطالبة السورية آية أبو ضاهر وعائلتها مغادرة الدنمارك إلى سوريا فوراً، وذلك لأن الطالبة كتب.",0
توجهت د. هالة السعيد، وزيرة التخطيط والتنمية الاقتصادية ورئيس مجلس إدارة صندوق مصر السيادي؛ بالتهنئة إلى شركات مصر القابضة للتأمين - إحدى شركات الصندوق السيادى- لحصولها على أعلى درجة ائتمانية..,1
 تداولت مواقع وصفحات عامة وحسابات شخصية على (فيسبوك) و(تويتر)، صورة لوثيقة بدت أنها صادرة عن (مديرية أوقاف دمشق) التابعة لوزارة الأوقاف في حكومة النظام السوري، تطلب من خطباء ال.,0
أصيب 9 عمال، اليوم الخميس، فى حادث انقلاب سيارة ميكروباص بطريق أسيوط الصحراوى الغربى باتجاه قرية منشاة الجمال بدائرة مركز شرطة طاميه بمحافظة الفيوم.,1
تداول ناشطون على مواقع التواصل الاجتماعي منشورات تدّعي أن وزارة التخطيط في العراق ستطلق سياسية ” تنظيم النسل” الشهر المقبل،,0
"تبدأ البنوك العاملة فى مصر وعددها 37 بنكا، اليوم الثلاثاء إجازة تستمر حتى يوم الأحد المقبل بمناسبة عيد الفطر المبارك.

",1
قال رافائيل جروسي رئيس الوكالة الدولية للطاقة الذرية، إن منتدى Atomexpo يعد حدثا هاما في التقويم العالمي للأحداث النووية حيث يعد من أهم المؤتمرات في سياق البحث عن حلول,1
"يفتتح اللواء أحمد راشد محافظ الجيزة، اليوم، مسجد الروضة بحدائق الأهرام، وذلك فى إطار احتفالات المحافظة بعيدها القومى الذى يوافق 31 مارس.
",1
"استهدف التحالف الوطنى للعمل الأهلى التنموى توزيع كارت ملابس العيد للأطفال، بقيمة 500 جنيه لـ1500 طفل بإجمالى تكلفة 750 ألف جنيه..
",1
قال المستشار أمير رمزي رئيس مجلس أمناء مؤسسة راعي مصر عضو التحالف الوطني للعمل الأهلي التنموي إن المؤسسة تواصل جهودها  خلال شهر رمضان الكريم من أجل دعم الأسر ,1
نشرت صفحة (السويداء ANS) الإخبارية على موقع فيسبوك يوم الثلاثاء 13 شباط/ فبراير، صورة زعمت أنها تظهر القيادي في الحرس الثوري الإيراني إسماعيل قآني متخفياً بلباس نسائي في شوارع ريف.,0
أكد تقرير لوزارة التخطيط والتنمية الاقتصادية على  أهمية الشراكة الاستراتيجية بين جمهورية مصر العربية ,1
انتشر على مواقع التواصل الاجتماعي فيسبوك وتويتر خبر مفاده بأن منظمة الصحة العالمية قامت بتصنيف المدينة المنورة بالمدينة الآمنة من الأوبئة في العالم.,0
انتشرت على مواقع التواصل الاجتماعي فيسبوك وتويتر صورة يزعم ناشروها أنها تعود لطائرة “الشبح” التركية،,0
"أعلن الدكتور عاصم الجزار، وزير الإسكان والمرافق والمجتمعات العمرانية، عن تشكيل مجموعات عمل "" فرق طوارئ "" بالمدن الجديدة، بالتنسيق مع مسئولي الوزارة، لمتابعة سير العمل وانتظام المرافق.",1
"نشرت حسابات وصفحات على مواقع التواصل الاجتماعي صورتين لتصاعد ألسنة اللهب والدخان بشكل كثيف ادعوا أنهما تظهران ""تحطم طائرة وسط مدينة أبو ظبي في الإمارات"".",0
تداول رواد مواقع التواصل الاجتماعي صورة لملعب نادي المريخ السوداني يظهر فيها أكياس من البصل ويدّعي ناشرو الادعاء أن النادي يزرع البصل في ملعبه…,0
كانوا بمارسوا طقوسهم داخل الدبابة في غزة ولكن فجأة زارهم اليـاىىىـين 105 ..أقسم بالله تحس المشاهد من وحي الخيال، الحمد لله,0
"تأهل فريق باير ليفركوزن إلي نصف نهائي كأس ألمانيا الموسم الجاري 2023-2024، بعد الفوز على شتوتجارت 3-2 في الدور ربع النهائي من المسابقة.

",1
أكد الدكتور محمد معيط وزير المالية، أن الدكتور مصطفى مدبولي رئيس مجلس الوزراء، وافق على استمرار مبادرة دعم فائدة التسهيلات التمويلية المحفزة للقطاعات الإنتاجية,1
ذكر مقطع فيديو نشرته صحيفة الشعب اليومية الصينية في 16 نوفمبر 2022،,0
"ادعى الإعلامي المصري الشهير عمرو أديب في برنامج ""الحكاية"" الذي يقدمّه على قناة ""إم بي سي مصر""، أن ""عقوبة المثلية الجنسية في قطر هي الإعدام"".",0
"نُشر  لأول مرّة على موقع (مركز لوغانسك الإعلامي)، في 17 يوليو 2020، حيث ذكر في تقريره:""أن خمسة من بين 15 أوكرانيًا لقوا حتفهم أثناء تجربة لقاح فيروس كورونا الأمريكي"".",0
تمكنت قوات الحماية المدنية بمديرية أمن المنوفية ، من السيطرة على حريق هائل نشب بمصنع للزيوت بالمنطقة الصناعة بالسادات، وتتم الآن أعمال التبريد لمنع إشتعال الحريق ، تم تحرير محضر بالواقعة.,1
انتشرت على مواقع التواصل الاجتماعي فيسبوك وتويتر صورة تظهر مبنى على شكل قالب حلوى وادعى ناشرو الصورة بأنها تعود لمبنى في المانيا,0
"تداول مستخدمون لمواقع التواصل الاجتماعي مقطع فيديو يزعم ""وصول ضحايا سوريين في زلزال تركيا بسيارات إسعاف تركية إلى معبر باب الهوى الحدودي مع تركيا"".",0
كشفت تقارير صحفية أن مواجهة ديربي جدة بين فريق أهلي جدة ونظيره الاتحاد سوف تشهد غياب 17 لاعبًا في قمة الجولة الـ 26 من الدوري السعودي,1
"تداولت صفحات عامة وحسابات شخصية على مواقع التواصل الاجتماعي مقطع فيديو ادعوا أنه لـ "" انتشار قوات حفظ النظام في عصابات الأسد في حي الدريبة في مدينة جبلة، وإجبار الأهالي على كسر ال.",0
"نشرت مواقع إخبارية وصفحات عامة ومستخدمون على مواقع التواصل الاجتماعي إعلاناً منسوباً إلى ""سفارة الجمهورية العربية السورية في باريس"" يدعو من وصفهم بـ ""المواطنين السوريين الشرفاء"" الم.",0
أصيب 11 شخصا بإصابات مختلفة مابين كدمات وسحجات وكسور وجروح نتيجة تصادم سيارتين على طريق الإسماعيلية السويس بالقرب من كمين فنارة دائرة مركز فايد بمحافظة الإسماعيلية.,1
"طالب الألماني يورجن كلوب، المدير الفني لفريق ليفربول، جماهير فريقه، وكذلك مانشستر يونايتد، بعدم ترديد هتافات عنصرية خلال المباراة التي تجمعهما  بملعب ""أولد ترافورد"".",1
"ادعت مواقع إخبارية وصفحات عامة بمواقع التواصل الاجتماعي أن تركيا ستمنع عودة السوريين الذين خرجوا من الأراضي التركية إلى الأراضي السورية خلال الأسبوع الماضي في ""إجازة العيد"".",0
"ادّعت صفحات وحسابات على مواقع التواصل الاجتماعي ""احتراق مقر اجتماعات أستانة لمناقشة الملف السوري في كازاخستان""، ورافق  صورة تظهر مبنى يحترق.",0
"حدد قانون التأمينات الاجتماعية والمعاشات الصادر بالقانون رقم 148 لسنة 2019، شروط استحقاق الأبناء للمعاش في حالة إذا توفى المؤمن عليه أو صاحب المعاش.
",1
"تداولت صفحات ومجموعات إخبارية على مواقع التواصل الاجتماعي اليوم، تعميماً منسوباً لـ ""وزارة التربية والتعليم"" في حكومة الإنقاذ"" يشير إلى عدم اعترافها بالشهادة الثانوية الصادرة من ريف حلب ال.",0
حصل اليوم السابع على فيديو يوثق محاولات أهالى المنيا التواصل مع مزارع سقط داخل بئر عمقه يصل إلى 23 مترا، حيث أنزل الأهالى,1
نظم التحالف الوطني للعمل الأهلي التنموي ، اليوم الأربعاء ، بالتعاون مع مؤسسة أبو هشيمة للخير عضو التحالف الوطني يوما ترفيهيا و إفطارا رمضانيا احتفالًا بيوم اليتيم، بمشاركة 100 طفل من الأيتام,1
"واصل قطاع الأمن العام بالتنسيق مع مديريتى أمن (الدقهلية، المنوفية) جهود ملاحقة وضبط العناصر الإجرامية حائزى ومتجرى المواد المخدرة والأسلحة النارية والذخائر غير المرخصة

",1
تناقل ناشطون على فيسبوك صورة يدعي ناشروها أنها تظهر قرارًا نشرته الجريدة الرسمية في مصر يفيد باعتماد صرف علاوة غلاء استثنائية للعاملين في الوظيفة العمومية اعتباراً من مطلع يوليو الجاري،,0
التقى الدكتور علي الغمراوي، رئيس هيئة الدواء المصرية، وعدد من قيادات الهيئة من بينهم الدكتور أيمن الخطيب، نائب رئيس الهيئة، والدكتورة رشا زيادة، مساعد رئيس الهيئة لشئون التطوير الفني وتنمية القدرات..,1
"يتصدر فريق ريال مدريد جدول ترتيب الدوري الإسباني الموسم الجاري 2023-2024، قبل مواجهة فالنسيا فى العاشرة مساء اليوم، السبت، على ملعب ""ميستايا"".
",1
تتأثر محافظات الجمهورية بحالة عدم استقرار فى الأحوال الجوية بداية من اليوم الاثنين وتستمر حتى غد الثلاثاء نتيجة امتداد منخفض جوي في طبقات الجو العليا مصحوب بكتل هوائية..,1
"قصة إنسانية جديدة يعرضها برنامج ""حياة كريمة"" المذاع على قناة dmc، من تقديم أيمن مصطفى، والتى تجسد معانى الكفاح لشاب فقد قدمه ويعمل على توك توك",1
تناقل ناشطون على فيسبوك خبرًا يدعي أن الفلبين أصدرت مذكرة توقيف بحق بيل غيتس بتهمة القتل العمد،,0
يتداول رواد موقع التواصل الاجتماعي فيسبوك صورة يزعم ناشروها أنّها لخريطة أوكرانيا المحدثة نشرها التلفزيون الألماني ZDF بعد ضم روسيا 4 أقاليم منها.,0
": تداولت حسابات شخصية وصفحات عامة على مواقع التواصل الاجتماعي صوراً ادُعي أنها ""لثعبان ضخم خرج من أحد الحمامات في سوريا"".",0
"أكدت نقابة الصيادلة بالإسكندرية، عدم وجود خسائر بشرية أو اصابات نتيجة اندلاع حريق هائل فى أرض النادى البحرى لها بمنطقة سابا باشا .

",1
يتداول رواد مواقع التواصل خبرا يزعم أن أحد طياري شركة دلتا الأمريكية قد توفي خلال رحلة جوية بسبب لقاح كوفيد 19،,0
"نشرت صحف سوريّة رسمية وشبه رسمية خبراً يدّعي رفع مصرف سوريا المركزي سعر صرف الدولار مقابل الليرة السورية ليصبح بسعر 2500، مستندة بذلك على نشرة رسمية صادرة عن ""مصرف سورية المركزي"".",0
قال الدكتور أيمن محسب، عضو مجلس النواب، ومقرر لجنة أولويات الاستثمار بالحوار الوطني، إن استمرار انهيار السوق السوداء بعد قرار تحديد سعر الف وفقا لآليات السوق،,1
يتناقل رواد منصات التواصل الاجتماعي خبرا منسوبا لمنظمة الصحة العالمية مفاده أن جائحة كورونا اقتربت من نهايتها ، حتى في غياب التلقيح .,0
"قال النائب علاء عابد رئيس لجنة النقل والمواصلات بمجلس النواب ونائب رئيس البرلمان العربي، إن الدولة المصرية بقيادة الرئيس السيسي تقدر الدور الذي تلعبه وكالة الأونروا لتخفيف معاناة الأشقاء الفلسطينيين في قطاع غزة.

",1
تعد بطولة دوري أبطال أوروبا الأقوى فى العالم على الإطلاق، نظرا لأنها تضم أقوى أندية العالم، والتي تمتلك فى صفوفها أفضل اللاعبين، وتعد المباريات النهائية لدوري الأبطال أقوى المباريات كل عام,1
يتداول رواد مواقع التواصل صورة يزعم ناشروها أنها تظهر إعلانا من مطاعم في الولايات المتحدة،,0
"تداولت صفحات عامة وحسابات شخصية على مواقع التواصل الاجتماعي مقطع فيديو يظهر عناصر أمنية تفرق مظاهرة حاشدة في أحد الشوارع، وادعوا أنه لـ"" مواجهة شبيحة نظام الأسد لمظاهرات خرجت.",0
شارك الآلاف من المواطنين في أكبر إفطار نظمته مؤسسة حياة كريمة، على مستوى محافظة القاهرة اليوم الأربعاء، بشارع الأشراف بمنطقة الخليفة بحضور قيادات مؤسسة حياه كريمة.,1
 تناقل ناشطون على فيسبوك مقطعًا يدعون أنه يصور برقًا كبيرًا شوهد قبيل الزلزال الذي ضرب المغرب في 09 سبتمبر مخلفًا أكثر من 2497 قتيل، في إشارة إلى أن الزلزال مفتعل بواسطة برنامج “هارب”،,0
تناقلت صفحات إخبارية ومستخدمون لمواقع التواصل الاجتماعي، مقطعاً مصوراً يظهر تعرض فرقة موسيقية لهجوم واعتقال من قبل أشخاص ملثمين، زُعم أنه ملتقط حديثاً لفرقة من أصول أوكرانية تؤدي.,0
نشر حساب Zaid Tholaia على موقع التواصل الاجتماعي فيسبوك صورة وأرفقها بالنص الوصفي الآتي (من دون تصرّف):,0
حدد قانون البناء رقم 119 لسنة 2008، ضوابط تنظم مهام وعمل اتحادات الشاغلين فى العقارات، ونصت المادة (76)، على تتولى الوحدات المحلية المختصة قيد الاتحادات وتحديث البيانات الخاصة بعضويتها ومتابعة قيامها بالتزاماتها,1
"حرصا على تقديم الخدمات المتكاملة للقراء الكرام، يعرض ""اليوم السابع"" خدمة توفير جميع الأخبار العربية والعالمية على مدار الساعات الماضية، من خلال نشرة شاملة لأهم الأحداث.
",1
يتداول روّاد مواقع التواصل الاجتماعي صورة يزعم أنها وجبات طعام مجانية مقدمة للفقراء والمحتاجين في مدينة الكوت، من قبل مرشحة الانتخابات التشريعية العراقية سوسن عبد الحسن اللامي،,0
انتشرت على مواقع التواصل الاجتماعي صورة من جريدة البلاد الجزائرية يظهر فيها تصريح لمسؤول في الجيش الجزائري عقب فوز الجزائر في بطولة كأس العرب،,0
تمكن رجال المباحث بمديرية أمن الجيزة من القبض على عاطل لاتهامه بسرقة ألواح الطاقة الشمسية الخاصة برادار في الطريق السياحي بالهرم، وتم إحالته إلى النيابة المختصة للتحقيق.,1
"تعرض اليوم السابع من خلال سلسة حلقات تقدمها لقرائها في شهر رمضان الكريم بعنوان"" المجرم الصغير ""، والتي توضح عددا من الجرائم الغريبة التي أصبحت تملأ صفحات الحوادث اليومية بمختلف أنحاء العالم..",1
"شهدت النسخة الخامسة من معرض وزارة الزراعة المقام العام الحالى فى مبنى الزراعات المحمية بالدقى ضمن مبادرة "" من خير مزارعنا لاهالينا ""،  اقبالا كبيرا من المواطنين ",1
"نشرت صفحة محلية تسمى (شبكة أخبار اللاذقية) على موقع فيسبوك، ادعاء زعمت فيه أن ""دولة الكويت فتحت باب اللجوء أمام المخترعين وأصحاب الكفاءات والمؤهلات العلمية، من سن 18 وحتى 59""، وذل.",0
"أوجب القانون رقم 8 لسنة 2021 بإصدار قانون تنظيم عمليات الدم وتجميع البلازما لتصنيع مشتقاتها وتصديرها، على المتبرع بالدم أن يكون الامر تطوعا وبغير مقابل.

",1
"رصد موقع ""برلماني""، المتخصص في الشأن التشريعى والنيابى، في تقرير له تحت عنوان: ""لو مسافر أجازة العيد بره مصر.. احذر من حيازة ممنوعات ممكن توقف السفرية"".",1
فاز فريق الهلال ضد النصر بنتيجة 2-1 في المباراة التي أقيمت بينهما مساء الإثنين، على ملعب استاد محمد بن زايد، في مدينة أبو ظبي بالإمارات، في نصف نهائي كأس السوبر السعودي 2024..,1
انتشر على مواقع التواصل الاجتماعي مقطع فيديو يزعم ناشروه أنه يظهر شاب يلقي أنشودة دينية في برنامج المواهب وتأثر لجنة التحكيم، فما حقيقة هذا المقطع؟,0
تشهد درجات الحرارة انخفاضًا خلال الاسبوع المقبل على كافة أنحاء الجمهورية لتكون حول 24 °م شمالاً وحول 30 °م جنوباً نهاراً و انخفاض أيضاً في حرارة الليل ,1
"تداولت صفحات عامة وحسابات شخصية على مواقع التواصل الاجتماعي، حديثاً، مقطع فيديو ادعت أنه لمعاناة أطفال فلسطينيين جراء العدوان الإسرائيلي على قطاع غزة، وادعى ناشرون أن المقطع يظهر"".",0
"حسم فريق النصر أحداث الشوط الأول من مواجهة الطائي، بنتيجة 2-1، خلال المباراة التي تجمعهما حاليا على ملعب ""الأول بارك""، ضمن منافسات الجولة الـ25 من مسابقة الدوري السعودي للمحترفين..",1
تداول مستخدمو مواقع التواصل الاجتماعي صورة منشور يدعون أنه أعلن من قبل وزارة الصحة في إيرلندا عن مضاعفات ما بعد التطعيم ضد فيروس كوفيد-19،,0
ظهر الدولي المصري محمد صلاح لاعب ليفربول في تدريبات الريدز الأولى عقب انتهاء فترة التوقف الدولي الأخيرة وبدء الإستعداد لخوض منافسات المباريات المتبقية,1
"تحديث: عدل موقع قناة BBC بنسخته العربية قبل قليل عنوان الخبر المشار إليه، وصحح الاخطاء التي كانت فيه حول تبعية ""جيش الإسلام"" سابقاً، وانتماء العناصر الذين وافق ""جيش الإسلام"" على.",0
يتداول مستخدمو مواقع التواصل الاجتماعي مقطع فيديو يظهر -فيما يبدو- أنه من مؤتمر ما يتحدث فيه عدة أشخاص عن خطة لتقليل عدد السكان في العالم بالأخص في أفريقيا، وتناوله الناشرون كدليل على أن أخذ لقاح كوفيد-19 هو من سبل تخفيض سكان العالم،,0
ثَمَّن المهندس طارق النبراوي، نقيب المهندسين، قرار الدكتور مصطفى مدبولي رئيس الوزراء، بالموافقة على مشروع قرار إصدار اللائحة التنفيذية لقانون التصالح في بعض مُخالفات البناء وتقنين أوضاعها..,1
تناقل روّاد مواقع التواصل الاجتماعي خبرًا يزعم ناشروه أن حيوانًا منقرضًا عاد للظهور مجدّدًا، خطيرٌ لدرجة أنه يأكل عشرة رجال بأقل من دقيقة،,0
أستقبل مستشفى البلينا المركزى جنوب محافظة سوهاج، عامل زراعى مصابا برش خرطوش بالفخذين والظهر وتم تحويله لمستشفى سوهاج الجامعى الجديد لإستكمال العلاج,1
"نشرت صفحات إخبارية وحسابات عامة بمواقع التواصل الاجتماعي، تسجيلاً مصوراً يظهر مسلحين يصلبون جندياً مدعين أنه يظهر "" ابشع جرائم الروس في اوكرانيا"".",0
تداولت حسابات إخبارية على مواقع التواصل الاجتماعي أمس الاثنين واليوم الثلاثاء 17 و18 آب/ أغسطس 2020، تسجيلاً مصوراً لطائرة مروحية تهوي بعد إصابتها بصاروخ مضاد للطائرات من قبل مقاتل، بدا وك.,0
